source_family,status_target,priority,owner,official_pages,target_geography,integration_rule,model_role,created_utc,current_decision
phn_bridge_to_sa2,pending_bridge_or_join_if_local_file_exists,high,"Australian Government Department of Health, Disability and Ageing",https://www.health.gov.au/resources/collections/primary-health-networks-phns-collection-of-concordance-files | https://digital.atlas.gov.au/datasets/primary-health-networks,SA2_2021 to PHN,Join to SA2 only if an official PHN-to-2021-ABS concordance is present. Prefer 2017 PHN boundaries if aligning strictly to 2021 Census context; keep 2023 PHN as current-service context if used.,context_geography_or_grouping; not a raw socioeconomic predictor,2026-06-19T13:25:11.813866+00:00,Do not join until acquisition/bridge validation passes. Use current v03 NDIA context master as latest POC master.
lga_bridge_to_sa2,pending_bridge_or_join_if_local_file_exists,high,Australian Bureau of Statistics,https://www.abs.gov.au/statistics/standards/australian-statistical-geography-standard-asgs-edition-3/jul2021-jun2026/access-and-downloads/correspondences,SA2_2021 to LGA_2021/2022/2023,"Join to SA2 using official ABS correspondence only. Where an SA2 intersects multiple LGAs, retain largest allocation and audit multi-LGA SA2s.",context_geography_or_grouping; use cautiously because LGA is political/administrative geography,2026-06-19T13:25:11.813897+00:00,Do not join until acquisition/bridge validation passes. Use current v03 NDIA context master as latest POC master.
lhd_state_health_districts,pending_acquisition_state_specific,medium,State and territory health departments,https://www.health.nsw.gov.au/lhd/Pages/default.aspx | https://www.aihw.gov.au/about-our-data/aihw-data-by-geography,state health district / local hospital network / local health district to SA2,Do not join until state-specific boundaries or correspondences are validated. Names and boundary systems differ by jurisdiction.,service-system context only; may be grouped validation or descriptive layer,2026-06-19T13:25:11.813904+00:00,Do not join until acquisition/bridge validation passes. Use current v03 NDIA context master as latest POC master.
dss_social_security_sa2,pending_acquisition_high_priority,high,Department of Social Services / data.gov.au,https://data.gov.au/data/dataset/dss-payment-demographic-data | https://researchdata.edu.au/dss-payments-statistical-area-2/2976013 | https://researchdata.edu.au/dss-benefit-payment-quarterly-data/2975938,"SA2, LGA, postcode, electorate depending resource",Prioritise direct SA2 2021 resources. Select a reference period close to 2021-12-31 or 2022-06-30. Avoid postcode/electorate unless bridged.,candidate socioeconomic/service-demand predictors; needs payment-type scoping to avoid huge sparse feature set,2026-06-19T13:25:11.813910+00:00,Do not join until acquisition/bridge validation passes. Use current v03 NDIA context master as latest POC master.
housing_homelessness,pending_acquisition_review_geography,high,ABS / AIHW / Housing Data Australia,https://www.abs.gov.au/statistics/people/housing/estimating-homelessness-census/latest-release | https://www.aihw.gov.au/reports/homelessness-services/specialist-homelessness-services-annual-report/data | https://www.housingdata.gov.au/dashboard/meovkmx92o8jo45,SA2/SA3 where available; otherwise LGA/PHN/state context only,Use direct SA2/SA3 Census homelessness or housing-stress data if downloadable. AIHW SHS is usually service-system data and may be state/jurisdiction or service-region level.,"candidate predictor domain: housing stress, homelessness, service demand; strong conceptual relevance",2026-06-19T13:25:11.813924+00:00,Do not join until acquisition/bridge validation passes. Use current v03 NDIA context master as latest POC master.
phidu_social_health_atlas,pending_acquisition_bridge_required,medium,"PHIDU, Torrens University Australia",https://phidu.torrens.edu.au/social-health-atlases/data | https://phidu.torrens.edu.au/social-health-atlases/indicators-and-notes-on-the-data/social-health-atlases-of-australia-contents | https://phidu.torrens.edu.au/social-health-atlases/data-archive/data-archive-social-health-atlases-of-australia,"PHA, LGA, PHN, Indigenous Area; usually not direct SA2",Do not join to SA2 until geography is confirmed. LGA/PHN workbooks can be held as context if LGA/PHN bridge is validated.,rich health/social indicator source; high value but bridge-dependent,2026-06-19T13:25:11.813929+00:00,Do not join until acquisition/bridge validation passes. Use current v03 NDIA context master as latest POC master.
aedc_child_development,pending_acquisition_bridge_required,medium,Australian Early Development Census / Australian Government Department of Education,https://www.aedc.gov.au/data-hub/accessing-aedc-data | https://www.aedc.gov.au/data-hub/public-data/additional-data | https://www.aedc.gov.au/data-hub/public-data/2024-aedc-results | https://www.education.gov.au/early-childhood/about/data-and-reports/australian-early-development-census,"AEDC community, national, state/territory and other public table geographies",Audit geography first. AEDC community boundaries are not the same as SA2. Do not join until a correspondence or stable aggregation rule exists.,child/family context optional predictor domain; likely sensitivity/context unless geography maps cleanly,2026-06-19T13:25:11.813934+00:00,Do not join until acquisition/bridge validation passes. Use current v03 NDIA context master as latest POC master.
carer_disability_psychosocial_support_demand,pending_acquisition_review,medium,NDIA / DSS / AIHW / state departments / public data portals,https://dataresearch.ndis.gov.au/datasets/participant-datasets | https://dataresearch.ndis.gov.au/reports-and-analyses/participant-dashboards/psychosocial | https://www.aihw.gov.au/about-our-data/aihw-data-by-geography | https://data.gov.au/data/dataset/dss-payment-demographic-data,SA2/SA3 preferred; PHN/LGA/service district only after bridge,"Public NDIA participant counts are already integrated as POC. Further psychosocial, carer and disability-demand layers need direct SA2/SA3 or validated bridge.",service-demand and equity context; avoid overclaiming because service use does not equal underlying need,2026-06-19T13:25:11.813938+00:00,Do not join until acquisition/bridge validation passes. Use current v03 NDIA context master as latest POC master.
